{
  "$schema": "./transcript.schema.json",
  "version": 1,
  "meta": {
    "title": "Customer interview — meeting copilot",
    "scenario": "customer_interview",
    "product_context": "Live conversation copilot with real-time transcription and suggestion cards",
    "duration_ms": 801000,
    "created_at": "2026-06-10T20:00:00Z"
  },
  "speakers": {
    "pm": {
      "name": "Pavel",
      "role": "Product Manager"
    },
    "customer": {
      "name": "Morgan Chen",
      "role": "Head of UX Research, Flowstack"
    }
  },
  "segments": [
    {
      "id": "seg-001",
      "start_ms": 0,
      "end_ms": 11000,
      "speaker": "pm",
      "text": "Hi Morgan, thanks for making time. I'm Pavel, product manager on a tool we're calling the meeting copilot. Is it okay if I use this call for product discovery? Nothing gets shared outside our team without your consent."
    },
    {
      "id": "seg-002",
      "start_ms": 12000,
      "end_ms": 17000,
      "speaker": "customer",
      "text": "Yes, that's fine. Happy to help. I've been curious about tools in this space anyway."
    },
    {
      "id": "seg-003",
      "start_ms": 18500,
      "end_ms": 28000,
      "speaker": "pm",
      "text": "Great. I'd love to start with your world. What does a typical customer interview look like for you — from before the call through what happens after you hang up?"
    },
    {
      "id": "seg-004",
      "start_ms": 29500,
      "end_ms": 52000,
      "speaker": "customer",
      "text": "Sure. I run about four to six interviews a week for a B2B workflow product — mostly PMs and ops leads. Before the call I pull a discussion guide in Google Docs. During the call I'm on Zoom with Otter transcribing in the background. I'm trying to listen, ask follow-ups, and jot notes at the same time, and that's the part that breaks down."
    },
    {
      "id": "seg-005",
      "start_ms": 53500,
      "end_ms": 61500,
      "speaker": "pm",
      "text": "In those Flowstack interviews — what kinds of problems do customers surface most often?"
    },
    {
      "id": "seg-006",
      "start_ms": 63000,
      "end_ms": 91000,
      "speaker": "customer",
      "text": "Two that come up constantly. First, spreadsheet shadow workflows — teams keep a parallel Google Sheet for status because Flowstack doesn't show cross-team handoffs clearly, and someone reconciles manually every Friday. Second, an onboarding cliff for new hires. New PMs take three or four weeks before they trust the product; veterans built mental workarounds the UI never teaches."
    },
    {
      "id": "seg-007",
      "start_ms": 92500,
      "end_ms": 100000,
      "speaker": "pm",
      "text": "When it breaks down, what's the first thing you lose — the thread, the notes, or something else?"
    },
    {
      "id": "seg-008",
      "start_ms": 101500,
      "end_ms": 127000,
      "speaker": "customer",
      "text": "The follow-up thread. Someone mentions a workaround they've used for months, I think I'll come back to it, the conversation moves on, and twenty minutes later I've lost the moment. After the call I skim Otter and find three questions I wish I'd asked while we were still talking."
    },
    {
      "id": "seg-009",
      "start_ms": 128500,
      "end_ms": 135000,
      "speaker": "pm",
      "text": "Can you give me a concrete example from a recent interview — something you meant to follow up on but didn't?"
    },
    {
      "id": "seg-010",
      "start_ms": 136500,
      "end_ms": 161000,
      "speaker": "customer",
      "text": "Last Tuesday an ops lead said simple requests sit in pending approval for days because approvers live in email, not in Flowstack. I nodded, made a note, and never got back to it. Same call — they mentioned the Friday spreadsheet reconciliation again. Two threads I should have pulled on while we were still talking."
    },
    {
      "id": "seg-011",
      "start_ms": 162500,
      "end_ms": 169000,
      "speaker": "pm",
      "text": "How long does the post-call synthesis take you per interview?"
    },
    {
      "id": "seg-012",
      "start_ms": 170500,
      "end_ms": 191000,
      "speaker": "customer",
      "text": "Roughly forty-five minutes to an hour. Highlighting quotes, tagging needs in Dovetail, updating our research board. Rich sessions run longer. It's valuable work, but it's all reactive — I'm reconstructing what I missed live."
    },
    {
      "id": "seg-013",
      "start_ms": 192500,
      "end_ms": 199000,
      "speaker": "pm",
      "text": "When you tag needs in Dovetail, which pains keep recurring across interviews?"
    },
    {
      "id": "seg-014",
      "start_ms": 200500,
      "end_ms": 235000,
      "speaker": "customer",
      "text": "Notification fatigue is huge — ops leads mute Flowstack alerts and then miss real blockers buried in routine updates. Integration friction too: context jumps between Slack threads and Flowstack, people paste screenshots because links don't carry enough state. And change fatigue when we ship workflow updates — no in-product guidance, support tickets spike for two weeks. Directors also keep asking for a rollup view they trust; right now they ping three people to answer where the team is stuck."
    },
    {
      "id": "seg-015",
      "start_ms": 236500,
      "end_ms": 248000,
      "speaker": "pm",
      "text": "Have you tried anything that helps during the call itself, not just transcription afterward?"
    },
    {
      "id": "seg-016",
      "start_ms": 249500,
      "end_ms": 279000,
      "speaker": "customer",
      "text": "I tried Granola briefly. Interesting, but it felt like another chat window dumping text while I'm trying to stay present on camera. I turned most of it off. Teams Copilot is more summary-after-the-fact — doesn't help me in the moment."
    },
    {
      "id": "seg-017",
      "start_ms": 280500,
      "end_ms": 315000,
      "speaker": "pm",
      "text": "Let me describe what we're building and you can react. You pick a mode like customer interview. Main area is a stable two-by-two grid of cards — follow-up questions, customer needs, risks, topics to explore. Not a chat stream. Transcript on the right, about a quarter of the screen. Cards update live: short items, one-line rationale underneath. You discard, pin, or mark done without leaving the call."
    },
    {
      "id": "seg-018",
      "start_ms": 316500,
      "end_ms": 341000,
      "speaker": "customer",
      "text": "The stable grid is already different from what I didn't like about Granola. I want to know where to look. If cards stay in the same place every session, I could build a habit instead of hunting for the latest AI paragraph."
    },
    {
      "id": "seg-019",
      "start_ms": 342500,
      "end_ms": 353000,
      "speaker": "pm",
      "text": "What would make you distrust it or turn it off mid-interview?"
    },
    {
      "id": "seg-020",
      "start_ms": 354500,
      "end_ms": 385000,
      "speaker": "customer",
      "text": "Noise. If a new bullet appears every few seconds and it's the same idea rephrased, I'll ignore the product. Also anything that yanks my scroll at the wrong time. If I discard something, it should stay gone unless the participant actually brings that thread back with new evidence."
    },
    {
      "id": "seg-021",
      "start_ms": 386500,
      "end_ms": 401000,
      "speaker": "pm",
      "text": "We spec semantic dedupe and limited resurfacing for exactly that. Does that match your bar?"
    },
    {
      "id": "seg-022",
      "start_ms": 402500,
      "end_ms": 421000,
      "speaker": "customer",
      "text": "If it works, yes. I've had tools suggest 'ask about pricing' four times because someone said budget once. That's worse than no suggestion."
    },
    {
      "id": "seg-023",
      "start_ms": 422500,
      "end_ms": 437000,
      "speaker": "pm",
      "text": "Are those four card types right for your interviews, or would you rearrange them?"
    },
    {
      "id": "seg-024",
      "start_ms": 438500,
      "end_ms": 471000,
      "speaker": "customer",
      "text": "Follow-up questions and customer needs are non-negotiable. Risks less often in pure research, more in discovery calls. I'd want custom modes — swap in jobs-to-be-done and unmet needs — without rebuilding the whole UI. One research study shouldn't fight the default template."
    },
    {
      "id": "seg-025",
      "start_ms": 472500,
      "end_ms": 479000,
      "speaker": "pm",
      "text": "What unmet needs show up most often in your research tags?"
    },
    {
      "id": "seg-026",
      "start_ms": 480500,
      "end_ms": 513000,
      "speaker": "customer",
      "text": "Multi-stakeholder misalignment inside one account — the PM wants speed, ops wants an audit trail, IT wants SSO before anyone turns on a new integration. Same customer, conflicting jobs-to-be-done in a single interview. Enterprise compliance blockers are close behind: security reviews stall external sharing and customers want the product but can't flip features on."
    },
    {
      "id": "seg-027",
      "start_ms": 514500,
      "end_ms": 527000,
      "speaker": "pm",
      "text": "What would you want to set before the session starts?"
    },
    {
      "id": "seg-028",
      "start_ms": 528500,
      "end_ms": 553000,
      "speaker": "customer",
      "text": "Interview goal, participant segment, hypothesis I'm testing. If suggestions ignore that and stay generic, I wouldn't open the app. Context can't be an afterthought."
    },
    {
      "id": "seg-029",
      "start_ms": 554500,
      "end_ms": 567000,
      "speaker": "pm",
      "text": "You saw a short Loom of the prototype — what landed, and what felt off?"
    },
    {
      "id": "seg-030",
      "start_ms": 568500,
      "end_ms": 607000,
      "speaker": "customer",